{"environment":{"atu_compiler_version":"0.2.1","atu_ir_version":"0.2.0","source_schema":"opentelemetry"},"episode_id":"atu-ep-b087508fbff90258d1","receipts":[{"idempotency_key":null,"input_digest":"sha256:87b2dce08c130c41c9e6ba8de499a8a19aec5ab467c75dc8f02d65864116ecf5","receipt_id":"r-c409b3da540ce8d85d","result_digest":"sha256:7a109d63e1e2be417650c46e20e48334ca42fdbe240fe83dad163d89a3292ac5","side_effect":false,"step_id":"s003-8e75c575","timestamp":"2024-06-29T22:26:42Z","tool_name":"synthetic_search","uri":"memory://synthetic/search/result"}],"redaction_policy":"standard","replay_class":"semi_deterministic","tools":[{"side_effect_count":0,"step_count":1,"tool_name":"synthetic_search"}]}
