{"environment":{"atu_compiler_version":"0.2.1","atu_ir_version":"0.2.0","source_schema":"openinference"},"episode_id":"atu-ep-8e279122f1c809bc16","receipts":[{"idempotency_key":null,"input_digest":"sha256:97c3d0b6e876b73a5af58ceec71a7e3f4cc35421777a3c619b74e159aadded3d","receipt_id":"r-a1895b7f2e4def05b5","result_digest":"sha256:0dc3af13bd98cc202bdab3be1ee37e1927d77bc4f034808c86bb613c75dc359d","side_effect":true,"step_id":"s002-08b48c30","timestamp":"2024-06-29T22:28:22Z","tool_name":"file_write","uri":"memory://synthetic/note.txt"}],"redaction_policy":"standard","replay_class":"receipt_only","tools":[{"side_effect_count":1,"step_count":1,"tool_name":"file_write"}]}
